nome,ocupacao,data_nascimento,data_morte,conteudo
Paul Simon, Cantor norte-americano,13/10/1941,não informado,"Paul Simon (1940) é um cantor, compositor e guitarrista, considerado um dos grandes intérpretes da música norte-americana."
Paul Verlaine, Poeta francês,30/03/1844,08/01/1896 (aos 51 anos),"Paul Verlaine (1844-1896) foi um importante poeta francês da segunda metade do século XIX. Seu lirismo musical exerceu influência decisiva no desenvolvimento do simbolismo e abriu novos caminhos para a poesia francesa. Não raro, os temas de seus poemas têm uma conotação mórbida e uma nota de melancolia."
Paul Ricoeur, Filósofo francês,27/02/1913,20/05/2005 (aos 92 anos),Paul Ricoeur foi um dos expoentes no campo da fenomenologia e da hermenêutica e é considerado um dos grandes nomes da filosofia contemporânea tendo sido inclusive uma referência para os filósofos Derrida (1930-2004) e Lyotard (1924-1998).
Paul Klee, Pintor suíço,18/12/1879,29/06/1940 (aos 60 anos),"Paul Klee (1879-1940) foi um pintor suíço, naturalizado alemão, considerado um dos artistas mais originais do movimento expressionista do início do século XX."
Paul Gauguin, Pintor francês,07/06/1848,09/05/1903 (aos 54 anos),"Eugène Henri Paul Gauguin, conhecido como Paul Gauguin, nasceu em Paris, França, no dia 7 de junho de 1848. Filho do jornalista francês Clovis Gauguin e de Aline Chazal, filha da escritora feminista Flora Tristán, filha de um peruano de origem espanhola (as trajetórias dela e do neto são tema do romance do também peruano Mário Vargas Llosa, O Paraíso na Outra Esquina)."
Paul Cézanne, Pintor francês,19/01/1852,22/10/1906 (aos 54 anos), Pintor francês
Paul McCartney, Cantor inglês,18/06/1942,não informado,"Paul McCartney (1942) é um cantor e compositor inglês, ex-integrante da banda de rock britânica “The Beatles”, que fez grande sucesso nos anos 60. A banda era formada por John Lennon, Paul McCartney, George Harrison e Ringo Starr. Com a dissolução da banda em 1970, Paul McCartney seguiu sua carreira solo."
Paul Allen, Empresário norte-americano,21/01/1953,15/10/2018 (aos 65 anos),"Paul Allen (1953-2018) foi um empresário norte-americano, cofundador da Microsoft, junto com Bill Gates, a maior desenvolvedora de software do mundo."
Patrícia Pillar, Atriz brasileira,11/01/1964,não informado,"Patrícia Pillar (1964) é uma atriz brasileira. Recebeu 15 premiações de melhor atriz, no papel da vilã e ex-presidiária Flora, na novela ""A Favorita"" apresentada na televisão em 2008. No papel de Zuzu Angel no cinema, recebeu 3 indicações de melhor atriz."
Patrícia Poeta, Jornalista e apresentadora brasileira,19/10/1976,não informado,Patrícia Poeta (1976) é jornalista e apresentadora brasileira da Rede Globo de Televisão.
Pablo Neruda, Poeta chileno,12/07/1904,23/09/1973 (aos 69 anos),"Pablo Neruda (1904-1973) foi um poeta chileno, considerado um dos mais importantes escritores em língua castelhana. Recebeu o Premio Nobel de Literatura em 1971."
Pablo Escobar, Narcotraficante colombiano,01/12/1949,02/12/1993 (aos 44 anos),"Pablo Emilio Escobar Gabiria (1949-1993) foi um narcotraficante, chefe do Cartel de Medellín, na Colômbia, uma organização criminosa sustentada pelo dinheiro do tráfico responsável pelo fornecimento de 80% da cocaína que foi despejada em vários países entre os anos de 1980 e 1990."
Pabllo Vittar, Cantor brasileiro,01/11/1994,não informado,Phabullo Rodrigues da Silva é um reconhecido cantor e drag queen brasileiro.
Otto von Bismarck, Político alemão,01/04/1815,30/07/1898 (aos 83 anos),Otto von Bismarck (1815-1898) foi um estadista prussiano e primeiro chanceler do Império Alemão. O preparo e eficiência do exército prussiano e a habilidade e diplomacia de Bismarck foram decisivos para a unificação dos territórios germânicos.
Otto Lara Resende, Escritor e jornalista brasileiro,01/05/1922,28/12/1992 (aos 70 anos),"Otto Lara Resende (1922-1992) foi um escritor e jornalista brasileiro, foi eleito membro da Academia Brasileira de Letras, para a cadeira nº. 39."
Otávio de Faria, Escritor brasileiro,15/10/1908,17/10/1980 (aos 72 anos),"Otávio de Faria (1908-1980) foi um escritor brasileiro. Membro da Academia Brasileira de Letras, foi eleito para a cadeira nº 27. Foi também jornalista, crítico literário e tradutor."
Oswald de Andrade, Escritor brasileiro,11/01/1890,22/10/1954 (aos 64 anos),"Oswald de Andrade (1890-1954) foi um escritor e dramaturgo brasileiro. Fundou junto com Tarsila do Amaral o ""Movimento Antropófago"". Foi uma das personalidades mais polêmicas do Modernismo."
Osvaldo Cruz, Médico sanitarista brasileiro,05/08/1872,11/02/1917 (aos 44 anos),"Osvaldo Cruz (1872-1917) foi um médico brasileiro. Sanitarista, bacteriologista e epidemiologista ele foi o responsável pela erradicação da peste bubônica, da febre amarela, da varíola no país."
Osvaldo Aranha, Político brasileiro,15/02/1894,27/01/1960 (aos 65 anos),"Osvaldo Aranha (1894-1960) foi um político, diplomata e advogado brasileiro, um dos nomes de maior destaque no cenário político brasileiro entre 1930 e 1954."
Osório, Militar e político brasileiro,10/05/1808,04/10/1879 (aos 71 anos),General Osório (1808-1879) foi militar e político brasileiro. É o Patrono da Arma de Cavalaria do Exército brasileiro. Herói da Guerra do Paraguai.
Osman Lins, Escritor brasileiro,05/07/1924,08/07/1978 (aos 54 anos),"Osman Lins (1924-1978) foi um escritor brasileiro. É o autor da peça “Lisbela e o Prisioneiro”, uma comédia romântica que foi adaptada para o cinema pelo diretor Gell Arraes."
Oscar Niemeyer, Arquiteto brasileiro,15/12/1907,05/12/2012 (aos 104 anos),"Oscar Niemeyer (1907-2012) foi um arquiteto brasileiro, responsável pelo planejamento arquitetônico de vários edifícios públicos de Brasília, a capital do Brasil. É um dos maiores representantes da arquitetura moderna mundial, com mais de 600 obras pelo mundo. Sua principal característica é o uso do concreto, vidro, curvas e vãos livres, com seu estilo inconfundível."
Oscarito, Ator brasileiro,16/08/1906,04/08/1970 (aos 63 anos),"Oscarito (1906-1970) foi um ator brasileiro, considerado um dos artistas mais populares da época das chanchadas do cinema brasileiro."
Oscar Wilde, Escritor irlandês,16/10/1854,30/11/1900 (aos 46 anos),"Oscar Wilde (1854-1900) foi um escritor irlandês, autor da obra “O Retrato de Dorian Gray”, seu único romance, considerado uma das mais importantes obras da literatura inglesa. Escreveu novelas, poesias, contos infantis e dramas. Foi mestre em criar frases irônicas e sarcásticas."
Osama bin Laden, Terrorista saudita,10/03/1957,01/05/2011 (aos 54 anos),"Osama bin Laden (1957-2011) foi um terrorista saudita. Fundou a organização terrorista Al-Qaeda, responsável por diversos atentados terroristas, entre eles, o das torres do World Trade Center, em Nova Iorque, em 11 de setembro de 2001."
Orson Welles, Cineasta norte-americano,06/05/1915,10/10/1985 (aos 70 anos),"Orson Welles (1915-1985) foi diretor, produtor, roteirista e ator de cinema norte-americano. Teve seu nome reconhecido na direção, atuação e roteiro do clássico do cinema ""Cidadão Kane""."
Oprah Winfrey, Apresentadora de TV norte-americana,29/01/1954,não informado,"Oprah Winfrey (1954) é uma apresentadora de TV norte-americana, vencedora de diversos prêmios Emmy por seu programa “The Oprah Winfrey Show”. É também jornalista, atriz, editora e escritora."
Oliver Cromwell, Militar e ditador inglês,25/04/1599,03/09/1658 (aos 59 anos),"Oliver Cromwell (1599-1658) foi um militar, ditador inglês e líder da Revolução Puritana que ocorreu na Inglaterra e substituiu a Monarquia por uma República. Governou como ditador com o título de Lorde Protetor do Estado Unificado (Inglaterra, Escócia e Irlanda)."
Olga Tokarczuk, Escritora polonesa,29/01/1962,não informado,"Olga Tokarczuk é uma celebrada escritora polonesa, autora de mais de uma dezena de livros traduzidos para 30 idiomas. "
Olga Benário, Militante comunista alemã,12/02/1908,23/04/1942 (aos 34 anos),Olga Benário (1908-1942) foi uma militante comunista alemã. Foi companheira de Luís Carlos Prestes e atuante no apoio à Intentona Comunista de 1935.
Olavo de Carvalho, Escritor brasileiro,26/04/1947,24/01/2022 (aos 74 anos),Olavo de carvalho (1947-2022) foi um escritor e jornalista brasileiro. Era considerado um polemista e um dos poucos representantes do pensamento conservador no Brasil. Foi influenciador dos apoiadores de Jair Bolsonaro.
Olavo Bilac, Poeta brasileiro,16/12/1865,28/12/1918 (aos 53 anos),"Olavo Bilac (1865-1918) foi um poeta, contista e jornalista brasileiro. É o autor da letra do Hino à Bandeira. Foi um dos principais representantes do Movimento Parnasiano que valorizou o cuidado formal do poema, em busca de palavras raras, rimas ricas e rigidez das regras da composição poética. É membro fundador da Academia Brasileira de Letras."
Olaf Scholz, Político e atual chanceler da Alemanha,14/06/1958,não informado,"Olaf Scholz é um político alemão que atualmente é o Chanceler da Alemanha, substituindo Angela Merkel. "
Odin, Deus nórdico,não informado,não informado,"Odin é um dos principais personagens da mitologia nórdica. A sua entidade fala de perto a cultura do norte da Europa (região da Alemanha, Noruega, Suécia, Dinamarca e Islândia)."
Octávio Paz, Poeta mexicano,31/03/1914,19/04/1998 (aos 84 anos),"Octávio Paz (1914-1998) foi poeta e pensador mexicano. Ganhou o Prêmio Nobel de Literatura de 1990. Foi ensaísta, tradutor e diplomata. Foi durante muitos anos, uma das personalidades mais influentes na vida cultural da América Latina."
Noel Rosa, Compositor brasileiro,11/12/1910,04/05/1937 (aos 26 anos),"Noel Rosa (1910-1937) foi um compositor, cantor e violonista brasileiro. Um dos mais importantes artistas da história da música popular brasileira. Em pouco tempo de vida compôs mais de 300 músicas, entre sambas, marchinhas e canções."
Nostradamus, Astrólogo francês,14/12/1503,02/07/1566 (aos 62 anos),"Nostradamus (1503-1566) foi um astrólogo, vidente e médico francês. Fez grandes profecias e algumas delas se concretizaram. Com as controvérsias sobre o fim do mundo em 2012, os estudos e leituras sobre Nostradamus tornaram-se cada vez maiores."
Norberto Bobbio, Filósofo italiano,18/10/1909,09/01/2004 (aos 94 anos), Filósofo italiano
Noé, Personagem bíblico,não informado,não informado,"Noé é um personagem bíblico, o escolhido por deus para construir uma arca e perpetuar a humanidade após o dilúvio. Sua história é contada no Livro do Gênesis."
Noam Chomsky, Professor norte-americano,07/12/1928,não informado,Noam Chomsky (1928) é professor e ativista político norte-americano. Tornou-se conhecido por suas críticas contra a política externa americana. É professor do Massachusetts Institute of Technology. Desenvolveu uma teoria que revolucionou o estudo da linguística.
Nise da Silveira, Psiquiatra brasileira,15/02/1905,30/10/1999 (aos 94 anos),Nise Magalhães da Silveira (1905-1999) foi uma psiquiatra brasileira reconhecida por 
Nina Simone, Cantora norte-americana,21/02/1933,21/04/2003 (aos 70 anos),"Nina Simone (1933-2003) foi uma pianista, cantora e compositora norte-americana. Além de uma das grandes vozes femininas do jazz, esteve comprometida com o ativismo pelos direitos civis dos negros do seu país."
Nilo Peçanha, Político brasileiro,02/10/1867,31/03/1924 (aos 56 anos),"Nilo Peçanha (1867-1924) foi um político brasileiro. Foi vice-presidente de Afonso Pena. Após a morte deste assumiu a presidência da República, permanecendo no poder entre 1909 e 1910."
Nilo Coelho, Político brasileiro,02/11/1920,09/11/1983 (aos 63 anos),"Nilo Coelho (1920-1983) foi um político pernambucano. Foi deputado estadual, deputado federal, governador de Pernambuco e senador. Desenvolveu uma política de eletrificação rural, Implantou o LAFEPE, a FIAM e ampliou a rede rodoviária estadual."
Nikola Tesla, Inventor austro-húngaro,10/07/1856,07/01/1943 (aos 86 anos),"Nikola Tesla (1856-1943) foi um inventor, austro-húngaro, nascido em Smiljan (Império Austro-húngaro), na atual Croácia, que deixou importantes contribuições para o desenvolvimento das tecnologias mais importantes dos últimos séculos, como da transmissão via rádio, da robótica, do controle remoto, do radar, da física teórica e nuclear e da ciência computacional."
Niklas Luhmann, Sociólogo alemão,08/12/1927,06/11/1998 (aos 70 anos),Niklas Luhmann (1927-1998) foi um sociólogo alemão que desenvolveu uma nova teoria sociológica - a teoria dos sistemas. Foi considerado um dos autores mais produtivos das ciências Sociais do século XX.
Nikolai Gogol, Escritor russo,01/04/1809,04/03/1852 (aos 42 anos),"Nikolai Gogol (1809-1852) foi um escritor russo. Sua obra situa-se no estilo do realismo da literatura russa, apesar de alguns trabalhos apresentarem características do surrealismo. Sua principal obra foi “Almas Mortas” - considerada a primeira novela russa moderna. Destacam-se também ""Diário de um Louco"" e ""Nariz""."
Nicole Kidman, Atriz norte-americana,20/06/1967,não informado,Nicole Kidman (1967) é uma atriz e produtora norte-americana. Recebeu o “Oscar de Melhor Atriz” pela interpretação de Virgínia Woolf no filme “As Horas”.
Niels Bohr, Físico dinamarquês.,07/10/1885,18/11/1962 (aos 77 anos),Niels Bohr (1885 - 1962) foi um físico dinamarquês. Estabeleceu o modelo atômico que lhe valeu o Prêmio Nobel de Física em 1922.
Nicolau Maquiavel, Filósofo político e escritor italiano,03/05/1469,22/07/1527 (aos 58 anos),"Nicolau Maquiavel (1469-1527) foi um filósofo político, historiador, estadista e escritor italiano, autor da obra-prima ""O Príncipe"". Foi profundo conhecedor da política da época, estudou-a em suas diferentes obras. Viveu durante o governo de Lourenço de Médici. Realista e patriota definiu os meios para a unificação da Itália."
Nicolau II, Czar russo,18/05/1868,17/07/1918 (aos 50 anos),Nicolau II (1868-1918) foi o último czar russo da longa dinastia dos Romanov que governou entre 1894 e 1917. Em 1918 ele foi assassinado junto com a czarina Alexandra e os cinco filhos do casal.
Nicolau Copérnico, Astrônomo polonês,19/02/1473,24/05/1543 (aos 70 anos),"Nicolau Copérnico (1473-1543) foi um astrônomo, matemático, médico e religioso polonês. Desenvolveu a teoria heliocêntrica, na qual colocava o sol no centro do Sistema Solar. Explicou como ocorrem as estações."
Morgan Freeman, Ator norte-americano,17/01/1942,não informado,"Morgan Freeman (1937) é um ator, produtor, diretor, dublador e narrador norte americano, um dos mais admirados atores das últimas décadas."
Montezuma II, Imperador asteca,não informado,não informado, Imperador asteca
Monteiro Lobato, Escritor brasileiro,18/04/1882,04/07/1948 (aos 66 anos),"Monteiro Lobato (1882-1948) foi um escritor e editor brasileiro. ""O Sítio do Pica-pau Amarelo"" é sua obra de maior destaque na literatura infantil. Criou a ""Editora Monteiro Lobato"" e mais tarde a ""Companhia Editora Nacional"". Foi um dos primeiros autores de literatura infantil de nosso país e de toda América Latina."
Monsenhor Waldir Lopes de Castro, Padre brasileiro,20/02/1931,22/12/2001 (aos 70 anos),Monsenhor Waldir Lopes de Castro (1931-2001) foi um padre brasileiro.
Montesquieu, Filósofo e escritor francês,18/01/1689,10/02/1755 (aos 66 anos),"Montesquieu (1689-1755) foi um filósofo social e escritor francês. Foi o autor de ""Espírito das Leis"". Foi o grande teórico da doutrina que veio a ser mais tarde a separação dos três poderes: Executivo, Legislativo e Judiciário. É considerado o autêntico precursor da Sociologia Francesa. Foi um dos grandes nomes do pensamento iluminista, junto com Voltaire, Locke e Rousseau."
Molière, Dramaturgo francês,15/01/1622,17/02/1673 (aos 51 anos),"Molière (1622-1673) foi um dramaturgo francês. Um dos maiores destaques do teatro francês no século XVII. Apoiado por Luís XIV, que admirava suas sátiras, comédias e tragédias, tornou-se o provedor dos divertimentos do rei."
Moisés, Líder religioso,não informado,não informado,"Moisés, segundo a Bíblia, foi um descendente dos hebreus que obediente a Deus teria libertado seu povo do cativeiro no Egito e liderado uma longa peregrinação até a terra de Canaã. Toda a vida de Moisés – seus atos, seus feitos, suas leis – é relatada em quatro livros da Bíblia: Êxodo, Levítico, Números e Deuteronômio, que somados ao Gênesis formam o Pentateuco."
Moacyr Scliar, Escritor brasileiro,23/03/1937,27/02/2011 (aos 73 anos),"Moacyr Scliar (1937-2011) foi um escritor e médico brasileiro. Contista, cronista e romancista, o gaúcho publicou mais de setenta livros, entre eles marcos da ficção moderna como ""O Centauro no Jardim""."
Miúcha, Cantora brasileira,30/11/1937,27/12/2018 (aos 81 anos),Heloísa Maria Buarque de Hollanda (1937-2018) foi uma importante cantora e compositora da música popular brasileira.
Mitt Romney, Político e empresário norte-americano,12/03/1947,não informado,Mitt Romney (1947) é um político e empresário norte-americano. Foi candidato à presidência dos Estados Unidos pelo Partido Republicano em 2012. Foi governador de Massachusetts entre 2003 e 2007.
Milton Santos, Geógrafo brasileiro,03/05/1926,24/06/2001 (aos 75 anos),"Milton Almeida dos Santos, conhecido apenas como Milton Santos, foi um reconhecido geógrafo brasileiro."
Milton Nascimento, Cantor  brasileiro,26/10/1942,não informado,"Milton Nascimento (1942) é um cantor e compositor brasileiro, um dos maiores nomes da Música Popular Brasileira."
Millôr Fernandes, Desenhista e jornalista brasileiro,16/08/1923,27/03/2012 (aos 88 anos),"Millôr Fernandes (1923-2012) foi um desenhista, humorista, tradutor, escritor e dramaturgo brasileiro. Era um artista com múltiplas funções. Escreveu colunas de humor para as revistas O Cruzeiro e Veja, para o tabloide O Pasquim, e para o Jornal do Brasil."
Milton Friedman, Economista norte-americano,31/07/1912,16/11/2006 (aos 94 anos),"Milton Friedman (1912-2006) foi um economista norte-americano, um dos maiores representantes do liberalismo na economia e da defesa do mercado. Suas teorias econômicas formaram um contraponto às ideias de John Maynard Keynes."
Miley Cyrus, Cantora e atriz norte-americana,23/11/1992,não informado,"Miley Cyrus (1992) é uma cantora, compositora e atriz norte-americana. Ficou famosa por ser a protagonista da série de televisão Hannah Montana que estreou no ano de 2006 pela Disney Channel."
Miles Davis, Músico norte-americano,26/05/1926,28/09/1991 (aos 65 anos),Miles Davis (1926-1991) foi um músico norte-americano. Trompetista e compositor esteve sempre na vanguarda do jazz. Foi homenageado com uma estrela na Calçada da Fama.
Mileide Mihaile," Empresária, influencer e bailarina",27/03/1989,não informado,"Mileide Mihaile é conhecida por ser empresária, influencer digital e bailarina."
Mikhail Bakunin, Teórico político russo,30/05/1814,01/07/1876 (aos 62 anos),"Mikhail Bakunin (1814-1876) foi um teórico político e destacado revolucionário russo, que teve importante papel para o desenvolvimento do anarquismo, na Europa Ocidental, do século XIX."
Mikhail Gorbachev, Ex-presidente da URSS,02/03/1931,não informado, Ex-presidente da URSS
Milan Kundera, Escritor tcheco,01/04/1929,não informado, Escritor tcheco
Mike Tyson, Ex-pugilista norte-americano,30/06/1966,não informado,"Mike Tyson (1966) é um ex-pugilista norte-americano. Em 1986, com 20 anos de idade, ele se tornou o mais jovem campeão mundial dos pesos pesados. Na carreira, foram 58 lutas e 44 nocautes."
Miguel Torga, Escritor português,12/08/1907,17/01/1995 (aos 87 anos),"Miguel Torga (1907-1995) foi um escritor português, um dos mais importantes poetas do século XX. Destacou-se também como contista, ensaísta, romancista e dramaturgo, deixando mais de 50 obras publicadas."
Miguel Reale, Jurista brasileiro,06/11/1910,14/04/2006 (aos 95 anos),"Miguel Reale (1910-2006) foi um jurista, filósofo e professor brasileiro. Tornou-se mundialmente conhecido com sua “Teoria Tridimensional do Direito”. Em 2002, coordenou e elaborou o novo Código Civil Brasileiro. Ocupou a cadeira n.º 14 da Academia Brasileira de Letras."
Miguel Falabella," Ator, diretor e escritor brasileiro",10/10/1956,não informado,"Miguel Falabella de Souza Aguiar, que adotou como nome artístico apenas Miguel Falabella, é um dos grandes nomes das artes cênicas brasileira. Reconhecido, ele atua há algumas décadas no teatro e na televisão como ator, diretor e dramaturgo."
Miguel de Unamuno, Escritor e filósofo espanhol,29/09/1864,31/12/1936 (aos 72 anos),"Miguel de Unamuno (1864-1936) foi um escritor e filósofo espanhol. Foi poeta, romancista, ensaísta, novelista e dramaturgo. Precursor do existencialismo, foi considerado um dos expoentes da chamada Geração de 98 da literatura espanhola."
Miguel de Cervantes, Escritor e dramaturgo espanhol,29/09/1547,23/04/1616 (aos 68 anos),"Miguel de Cervantes (1547-1616) foi um escritor, dramaturgo e poeta espanhol, autor de Dom Quixote, uma obra-prima da literatura universal, foi considerado o precursor do Realismo na Espanha."
Miguel Arraes, Político brasileiro,15/12/1916,13/08/2005 (aos 88 anos), Político brasileiro
Mick Jagger, Cantor britânico,26/07/1943,não informado,"Mick Jagger (1943) é um cantor, compositor, ator e produtor britânico. É o vocalista dos Rolling Stones, uma das mais antigas e mais famosas bandas de rock-and-roll."
Michelle Pfeiffer, Atriz norte-americana,29/04/1958,não informado,"Michelle Pfeiffer (1958) é uma atriz norte-americana. Recebeu o Globo de Ouro de Melhor Atriz em Drama, o Urso de Prata de Melhor Atriz, o BAFTA de Melhor Atriz Coadjuvante Secundária e três indicações ao Oscar."
Maysa, Cantora e compositora brasileira,06/06/1936,22/01/1977 (aos 40 anos),"Maysa (1936-1977) foi uma cantora e compositora brasileira, fez grande sucesso nas décadas de 1950 e 1960. É mãe de Jaime Monjardim, diretor de novelas. Faleceu prematuramente no Rio de Janeiro, vítima de um acidente na Ponte Rio-Niterói, em 1977."
Mayra Cardi, Modelo e atleta brasileira,05/09/1983,não informado,"Mayra Cardi ficou famosa após participar da nona edição do BBB. A musa fitness é atleta, influencer, empresária da saúde, life coach, modelo e já foi apresentadora de televisão. "
Maximiliano I, Imperador do Sacro Império Romano-Germânico,22/05/1459,12/01/1519 (aos 59 anos),Maximiliano I (1459-1519) foi um imperador do Sacro Império Romano-Germânico – um conjunto de territórios submetidos à autoridade dos soberanos germânicos.
Max Weber, Sociólogo e economista alemão,21/04/1864,14/06/1920 (aos 56 anos),"Max Weber (1864-1920) foi um importante sociólogo e destacado economista alemão. Suas grandes obras são, “A Ética Protestante e o Espírito do Capitalismo” e ""Economia e Sociedade"". Dedicou sua vida ao trabalho acadêmico, escrevendo sobres assuntos variados como o espírito do capitalismo e as religiões chinesas."
Max Lucado, Pastor evangélico e escritor,11/01/1955,não informado,Max Lucado (1955) é um pastor evangélico e escritor norte-americano. Vendeu cerca de 70 milhões de livros traduzidos em mais de vinte e oito idiomas.
Max Planck, Físico alemão,23/04/1858,04/10/1947 (aos 89 anos),"Max Planck (1858-1947) foi um físico alemão. Considerado o criador da ""teoria da física quântica"". Recebeu o Prêmio Nobel de Física em 1918."
Max Ernst, Pintor alemão,02/04/1891,01/04/1976 (aos 84 anos), Pintor alemão
Mauro Mota, Poeta brasileiro,16/08/1911,22/11/1984 (aos 73 anos),"Mauro Mota (1911-1984) foi um poeta, jornalista, cronista e professor brasileiro. Foi eleito para a Academia Brasileira de Letras, ocupando a Cadeira nº 26."
Mauricio de Sousa, Cartunista brasileiro,27/10/1935,não informado,"Mauricio de Sousa (1935) é um cartunista e empresário brasileiro. Criou a ""Turma da Mônica"", e vários outros personagens de história em quadrinhos. É membro da Academia Paulista de Letras, ocupando a cadeira nº. 24. É o mais famoso e premiado autor brasileiro de história em quadrinhos."
Maurício de Nassau, Militar de origem alemã,17/06/1604,20/12/1679 (aos 75 anos),"Maurício de Nassau (1604-1679) foi um conde, militar e administrador holandês. Governou as províncias holandesas no Brasil, instalou a capital do Brasil holandês na cidade do Recife, na capitania de Pernambuco."
Maurice Halbwachs, Sociólogo francês,11/03/1877,16/03/1945 (aos 68 anos),"Maurice Halbwachs (1877-1945) foi um sociólogo francês, destacado por seus trabalhos sobre a memória coletiva."
Matt Damon, Ator norte-americano,08/10/1970,não informado,"Matt Damon (1970) é um ator, roteirista e produtor norte-americano. Entre seus filmes destacam-se: “Gênio Indomável”, ""O Resgate do Soldado Ryan"", ""Os Infiltrados"" e ""Perdidos em Marte""."
Matias de Albuquerque, Governador Geral do Brasil,não informado,não informado,Matias de Albuquerque (1595-1647) foi Governador Geral do Brasil e Governador da Capitania de Pernambuco. Recebeu o título de Conde de Alegrete.
Matheus Nachtergaele, Ator  brasileiro,03/01/1969,não informado,"Matheus Nachtergaele (1969) é um ator brasileiro. Participou de importantes filmes, entre eles, ""O Auto da Compadecida"", ""Cidade de Deus"" e ""Serra Pelada""."
Matheus e Kauan,não informado,não informado,não informado,"Matheus e Kauan é uma dupla brasileira de cantores de música sertaneja, formada pelos irmãos Matheus Aleixo e Kauan Osvaldo."
Mata Hari, Dançarina holandesa,07/08/1876,15/10/1917 (aos 41 anos), Dançarina holandesa
