nome,ocupacao,data_nascimento,data_morte,conteudo
Michelle Obama, Ex-primeira dama norte-americana,17/01/1964,não informado,"Michelle Obama (1964) é uma advogada norte-americana. Foi primeira-dama dos Estados Unidos entre 2009 e 2017. Esposa do ex-presidente Barack Obama, foi a primeira afrodescendente a ocupar o posto de primeira-dama."
Michelle Bolsonaro, Primeira-Dama do Brasil,22/03/1980,não informado,Michelle Bolsonaro (1980) é a Primeira-Dama do Brasil e ativista das causas sociais e inclusivas. Foi secretária parlamentar da Câmara dos Deputados.
Michel Legrand, Músico francês,24/02/1932,26/01/2019 (aos 86 anos),"Michel Legrand (1932-2019) foi um músico francês, pianista, compositor e arranjador, premiado com três estatuetas do Oscar por trilhas sonoras de clássicos do cinema, trabalhou com grandes nomes da música, como Frank Sinatra, Edith Piaf e Robert Altman."
Michelangelo, Pintor e escultor italiano,06/03/1475,18/02/1564 (aos 88 anos),"Michelangelo (1475-1564) foi um pintor, escultor e arquiteto italiano, considerado um dos maiores representantes do Renascimento Italiano. ""Pietá"", ""O Juízo Final"", ""Moisés"", ""Davi"" e ""A Abóbada da Capela Sistina"" são algumas das obras que eternizaram o artista. "
Michel Temer, Político brasileiro,23/09/1940,não informado,Michel Temer (1940) é um político brasileiro. A tomada de posse como presidente da República aconteceu depois que o senado aprovou o 
Michel Foucault, Filósofo francês,15/10/1926,25/06/1984 (aos 57 anos),"Michel Foucault (1926-1984) foi um filosofo francês, que exerceu grande influência sobre os intelectuais contemporâneos. Ficou conhecido por suas posição contrária ao sistema prisional tradicional."
Michel Teló, Cantor e compositor brasileiro,21/01/1981,não informado,"Michel Teló (1981) é um cantor e compositor brasileiro e multi-instrumentista. Compôs, entre outros, os sucessos “Amanhã Sei Lá”, ""Ai Se Eu Te Pego"", “Fugidinha”, “Larga De Bobeira”, “Ei, Psiu! Beijo Me Liga” e “Se Intrometeu”."
Michael Jordan, Ex-jogador norte-americano,17/02/1963,não informado,Michael Jordan (1963) é um ex-jogador de basquetebol norte-americano que atuava como meio armador. É considerado um dos maiores jogadores de todos os tempos.
Michel de Montaigne, Escritor francês,28/02/1533,13/09/1592 (aos 59 anos),"Michel de Montaigne (1533-1592) foi um escritor, jurista, político e filósofo francês, o inventor do gênero ensaio. Foi considerado um dos maiores humanistas franceses."
Michael Jackson, Cantor norte-americano,29/08/1958,25/06/2009 (aos 50 anos),"Michael Jackson (1958-2009), conhecido como o Rei do Pop (apelido dado por Elizabeth Taylor), foi um cantor, compositor e dançarino norte-americano. Ele foi um dos maiores artistas do "
Michael Faraday, Físico e químico inglês,22/09/1791,25/08/1867 (aos 75 anos),"Michael Faraday (1791-1867) foi um físico e químico inglês. Em 29 de agosto de 1831 descobriu a indução eletromagnética. Foi o pai do motor elétrico e do gerador elétrico. É de sua autoria os termos técnicos usados na eletrólise como: eletrodo, eletrólito e íon."
Michael Phelps, Nadador norte-americano,30/06/1985,não informado,"Michael Phelps (1985) é um nadador norte-americano, considerado um dos maiores nadadores do mundo, conquistou o recorde ao ganhar 8 medalhas de ouro em uma só olimpíada."
Mia Couto, Escritor moçambicano,05/07/1955,não informado,"Mia Couto (1955) é um escritor, poeta e jornalista moçambicano. Ganhador do Prêmio Camões de 2013. Foi eleito para a Academia Brasileira de Letras para a cadeira n.º 5."
Mestre Yoda,não informado,não informado,não informado,Mestre Yoda é um personagem fictício da série de filmes Star Wars (Guerra nas Estrelas) do cineasta George Lucas. É o membro mais importante do Alto Conselho Jedi. Sábio e poderoso liderou o Conselho por mais de 800 anos.
Mestre Vitalino, Artista popular brasileiro,10/07/1909,20/01/1963 (aos 53 anos),"Mestre Vitalino (1909-1963) foi um artista popular brasileiro, considerado um dos maiores artistas da história da arte do barro no Brasil."
Mestre Ataíde, Pintor do Brasil Colonial,18/10/1762,02/02/1830 (aos 67 anos),Mestre Ataíde (1762-1830) foi um pintor brasileiro da época colonial. Foi um dos mais importantes artistas do barroco mineiro.
Meryl Streep, Atriz norte-americana,22/06/1949,não informado,"Meryl Streep (1949) é uma atriz norte-americana, consagrada como uma das mais talentosas e premiadas da história do cinema. Já concorreu vinte vezes ao Oscar vencendo três vezes, com Kramer vc. Kramer, A Escolha de Sofia e A Dama de Ferro."
Mem de Sá, Governador Geral do Brasil,não informado,não informado,"Mem de Sá (1498-1572) foi o terceiro governador geral do Brasil. Em sua administração, os franceses foram expulsos da Guanabara, foi fundada a cidade de São Sebastião do Rio de Janeiro e foram formadas as primeiras missões com objetivo de catequizar os índios."
Menotti Del Picchia, Escritor brasileiro,20/03/1892,23/08/1988 (aos 96 anos),"Menotti Del Picchia (1892-1988) foi um poeta, romancista, ensaísta, cronista, jornalista, advogado e político brasileiro. Foi ativista do Modernismo, mas sua obra mais marcante é o poema “Juca Mulato”, em que a temática é o caboclo, o maior traço do Pré-Modernismo."
Melania Trump, Primeira-dama dos Estados Unidos,26/04/1970,não informado,"Melanija Knavs, conhecida como Melania Trump, é atualmente a primeira-dama dos Estados Unidos."
Meghan Markle, Esposa do príncipe Harry,04/08/1981,não informado,"Meghan  Markle (1981) é a esposa do príncipe Harry, o sexto na linha de sucessão  do trono britânico. O casal recebeu o título de Duque e Duquesa de Sussex. Meghan é ex-atriz norte-americana. "
Meg Cabot, Escritora norte-americana,01/02/1967,não informado,"Meg Cabot (1967) é uma escritora norte-americana de literatura juvenil. Com diversos títulos publicados é conhecida principalmente pelo livro “O Diário da Princesa”, o primeiro da série do mesmo nome, que se tornou um best-seller."
MC Loma, Cantora brasileira,29/10/2002,não informado,Paloma Roberta Silva Santos é uma cantora de funk e pop brasileira que estourou na internet após lançar o hit 
Nicette Bruno, Atriz brasileira,07/01/1933,não informado,"Nicette Bruno (1933-2020) é uma atriz brasileira. Integrou diversas companhias de teatro do país, recebendo vários prêmios de Melhor Atriz. Junto com Paulo Goulart formava um dos casais mais queridos da televisão brasileira."
Nicholas Sparks, Escritor norte-americano,31/12/1965,não informado,"Nicholas Sparks (1965) é um escritor norte-americano que obteve grande sucesso literário com os romances, “Diário de Uma Paixão”, “Querido John”, “A Última Música”, “Um Porto Seguro”, entre outros, muitos deles adaptados para o cinema."
Niccolò Paganini, Compositor e violonista italiano,27/10/1782,27/05/1840 (aos 57 anos),"Niccolò Paganini (1782-1840) foi um compositor e brilhante violonista italiano, considerado o maior virtuose do século XIX foi um dos criadores da estética musical romântica."
Nero, Imperador romano,não informado,não informado,"Nero (37 – 68) foi imperador romano entre os anos de 54 e 68 da era cristã. Foi o quinto representante da dinastia Júlio – Claudiana formada pelos imperadores, Augusto, Tibério, Calígula, Cláudio e Nero. Tornou-se um dos mais cruéis imperadores da história de Roma."
Nelson Rodrigues, Escritor brasileiro,23/08/1912,21/12/1980 (aos 68 anos),"Nelson Rodrigues (1912-1980) foi um escritor, jornalista e dramaturgo brasileiro. Revolucionou o teatro, com as peças, ""Vestido de Noiva"", ""Boca de Ouro"", ""A Falecida"", ""Toda Nudez Será Castigada"", entre outras. Teve a carreira marcada pela crítica, ao explorar a vida cotidiana do subúrbio carioca, com crimes, incestos e diálogos carregados de tragédia e humor."
Neymar, Jogador de futebol brasileiro,05/02/1992,não informado,"Neymar (1992) é um futebolista brasileiro, considerado um dos maiores da história. Ganhou diversos títulos jogando pelo Santos Futebol Clube, onde iniciou sua carreira aos 11 anos de idade. Sua posição é atacante. Jogador polêmico namorou uma menor de idade de 17 anos, com que tem um filho."
Nelson Motta, Jornalista e produtor musical brasileiro,20/10/1944,não informado,"Nelson Motta (1944) é um jornalista, compositor, produtor musical, apresentador e escritor brasileiro."
Nelson Mandela, Político sul-africano,18/07/1918,05/12/2013 (aos 95 anos),"Nelson Mandela (1918-2013) foi presidente da África do Sul. Foi o líder do movimento contra o Apartheid - legislação que segregava os negros no país. Condenado em 1964 à prisão perpetua, foi libertado em 1990, depois de grande pressão internacional. Recebeu o “Prêmio Nobel da Paz”, em dezembro de 1993, pela sua luta contra o regime de segregação racial."
Nicolas-François Appert, Inventor e industrial francês,17/11/1749,01/06/1841 (aos 91 anos), Inventor e industrial francês
Nicolás Maduro, Político venezuelano,23/11/1962,não informado,"Nicolás Maduro (1962) é um político venezuelano que preside a Venezuela desde 2012, após a doença e morte do presidente Hugo Chaves. Sua gestão é marcada pelo autoritarismo, pelo declínio socioeconômico, inflação e o crescimento da pobreza."
Nicolas Poussin, Pintor francês,19/11/1665,não informado,"Nicolas Poussin (1594-1665) foi um pintor francês, considerado um dos principais representantes do classicismo na pintura francesa."
Nelson Ferreira, Músico brasileiro,09/12/1902,21/12/1976 (aos 74 anos),"Nelson Ferreira (1902-1976) foi um músico brasileiro. Compôs músicas de carnaval, valsas, foxtrote, tangos e canções diversas. Criou a orquestra Nelson Ferreira, que era famosa no Recife e nos estados vizinhos."
Nélida Piñon, Escritora brasileira,03/05/1937,não informado,Nélida Piñon (1937) é uma escritora brasileira. Foi eleita a primeira mulher a presidir a Academia Brasileira de Letras por ocasião do seu primeiro centenário em 1997.
Nefertiti, Rainha do Egito,não informado,não informado,"Nefertiti foi uma rainha do Egito da XVIII dinastia. Foi casada com o faraó do Novo Império, Amenófes IV. Juntos empreenderam uma revolução religiosa e passaram a adorar apenas um deus Aton, simbolizado pelo disco solar."
Neil Armstrong, Astronauta norte-americano,05/08/1930,25/08/2012 (aos 82 anos),"Neil Armstrong (1930-2012) foi o primeiro homem a pisar na Lua. Comandante da Nave Apollo 11, ele deixou as suas pegadas no solo lunar no dia 20 de julho de 1969."
Natuza Nery, Jornalista brasileira,28/04/1977,não informado,Natuza Nery é uma reconhecida jornalista brasileira que atua especialmente nas áreas política e econômica.
Nathália Timberg, Atriz brasileira,05/08/1929,não informado,"Nathália Timberg (1929) é uma atriz brasileira, uma das mais consagradas atrizes da televisão, do teatro e do cinema brasileiro."
Nara Leão, Cantora brasileira,19/01/1942,07/06/1989 (aos 47 anos),"Nara Lofego Leão (1942-1989) foi uma importante cantora, artista plástica e atriz brasileira que ficou conhecida como ""a musa da bossa nova""."
Nara Almeida, Modelo brasileira,08/09/1993,21/05/2018 (aos 24 anos),"Elyanara Almeida Feitosa Bonfim, conhecida como Nara Almeida, foi uma modelo brasileira, influencer e instagrammer que faleceu aos 24 anos vítima de um câncer raro no estômago."
Napoleão Bonaparte, Imperador francês,15/08/1769,05/05/1821 (aos 51 anos),"Napoleão Bonaparte (1769-1821) foi imperador da França entre 1804 e 1814 com o título de Napoleão I. Líder político, ditador e comandante do Exercito Francês, conquistou uma grande extensão territorial para a França."
Napoleão III, Imperador francês,20/04/1808,09/01/1873 (aos 64 anos),"Napoleão III (1808-1873) foi imperador da França. Aclamado presidente da República, pelo povo, para o mandato de quatro anos, com um golpe de estado restaurou o trono francês e tornou-se imperador da França sob o título de Napoleão III."
Naná Vasconcelos, Músico brasileiro,02/08/1944,09/03/2016 (aos 71 anos),"Naná Vasconcelos (1944-2016) foi um músico brasileiro, eleito oito vezes o melhor percussionista do mundo pela revista americana de jazz DownBeat."
Nabucodonosor II, Rei da Babilônia,não informado,não informado,Nabucodonosor II (630-561 a. C.) foi rei da Babilônia entre 605 e 561 a. C. Lutou contra os egípcios pela posse da Síria e da Palestina. Por diversas vezes sitiou Jerusalém conduzindo os judeus ao cativeiro da Babilônia. Submeteu os fenícios depois de uma guerra de 13 anos.
Naamã,não informado,não informado,não informado,"Segundo relato bíblico, Naamã foi um conhecido general sírio que contraiu lepra e acabou se curando graças a um milagre realizado pelo profeta Eliseu."
Mussum, Humorista brasileiro,07/04/1941,29/07/1944 (aos 3 anos),"Mussum (1941-1994) foi um humorista, ator e sambista brasileiro. Integrou o quarteto Os Trapalhões e o grupo musical Originais do Samba."
Murilo Mendes, Poeta brasileiro,13/05/1901,13/08/1975 (aos 74 anos),"Murilo Mendes (1901-1975) foi um poeta brasileiro. Fez parte do Segundo Tempo Modernista. Recebeu o Prêmio Graça Aranha com seu primeiro livro ""Poemas"". Participou do Movimento Antropofágico, que buscava uma vinculação com as origens do Brasil."
Murilo Benício, Ator brasileiro,13/07/1972,não informado,Murilo Benício (1972) é ator brasileiro. Conhecido pela  atuação na novela “O Clone”. Foi casado com a atriz Giovanna Antonelli.
Muhammad Ali, Pugilista norte-americano,17/01/1942,03/06/2016 (aos 74 anos),"Muhammad Ali (1942-2016) foi um pugilista norte-americano, considerado um dos maiores boxeadores da história."
Murillo La Greca, Pintor brasileiro,03/08/1899,05/07/1985 (aos 85 anos),"Murillo La Greca (1899-1985) foi um pintor, escultor e professor brasileiro, o primeiro a implantar no Nordeste, na Escola de Belas Artes, a disciplina de Modelo Vivo."
Moura Cavalcanti, Político brasileiro,20/10/1925,28/11/1994 (aos 69 anos),"Moura Cavalcanti (1925-1994) foi um político, advogado e administrador brasileiro. Exerceu diversos cargos públicos. Foi Ministro da Agricultura, no governo do presidente Médici. Foi Governador de Pernambuco entre os anos de 1975 e 1979."
Morihei Ueshiba, Mestre de artes marciais,14/12/1883,26/04/1969 (aos 85 anos),"Morihei Ueshiba (1883-1969) foi um mestre de artes marciais do Japão, fundador do Aikido (arte da paz). Foi considerado um dos melhores mestres da história das artes marciais."
Patativa do Assaré, Poeta popular,05/03/1909,08/07/2002 (aos 93 anos),"Patativa do Assaré (1909-2002) foi um poeta e repentista brasileiro, um dos principais representantes da arte popular nordestina do século XX. Com uma linguagem simples, porém poética, retratava a vida sofrida e árida do povo do sertão. Projetou-se nacionalmente com o poema ""Triste Partida"" em 1964, musicado e gravado por Luiz Gonzaga. Seus livros, traduzidos em vários idiomas, foram tema de estudos na Sorbonne, na cadeira de Literatura Popular Universal."
Parmênides,não informado,não informado,não informado,"Parmênides (510 – 445 a. C.) foi um filósofo grego da Antiguidade, o primeiro pensador a discutir questões relativas ao “Ser”. Foi um dos três mais importantes filósofos da escola eleática, junto com Xenófanes e Zenão."
Paris Hilton, Atriz e empresária norte-americana,17/02/1981,não informado,"Paris Hilton (1981) é uma empresária, modelo, atriz, compositora e cantora norte-americana. Atuou em vários vídeos publicitários e protagonizou várias polêmicas, entre elas, a briga com a atriz Lindsay Lohan."
Paramahansa Yogananda, Iogue e guru indiano,05/01/1893,07/03/1952 (aos 59 anos),"Paramahansa Yogananda (1893-1952) foi um iogue e guru indiano, considerado um dos maiores emissários da antiga filosofia da Índia para o Ocidente."
Paracelso, Médico suíço,10/11/1493,24/09/1541 (aos 47 anos),"Paracelso (1493-1541) foi um médico, alquimista e filósofo suíço. Revolucionou a medicina de seu tempo ao anunciar alguns dos princípios que seriam resgatados no século XIX."
Papa Pio IX, Papa da Igreja Católica,13/05/1792,07/02/1878 (aos 85 anos),"Papa Pio IX (1792-1878) foi Papa entre os anos de 1846 e 1878. Seu pontificado foi marcado pelas lutas pela unificação da Itália. Foi beatificado em 3 de setembro de 2000, pelo Papa João Paulo II."
Papa Leão XIII, Papa da Igreja Católica,02/03/1810,20/07/1903 (aos 93 anos),Papa Leão XIII (1810-1903) foi Papa da Igreja Católica entre os anos de 1878 e 1903. Seu pontificado foi marcado pela diplomacia e conciliação. Lançou as bases da doutrina social da Igreja.
Papa Francisco, Religioso católico,17/12/1936,não informado,"Papa Francisco (1936) é um religioso católico, o 226.º papa da história da Igreja, o primeiro pontífice não europeu em 1 200 anos. É o primeiro papa vindo da América Latina. Foi eleito Papa no conclave de 13 de março de 2013."
Pancho Villa, Revolucionário mexicano,05/06/1878,20/07/1923 (aos 45 anos), Revolucionário mexicano
Pagu, Escritora brasileira,09/06/1910,12/12/1962 (aos 52 anos),"Pagu (1910-1962) foi uma escritora, jornalista, produtora cultural e militante política brasileira. Foi a primeira mulher brasileira a ser presa política no século XX."
Padre Quevedo, Padre jesuíta e parapsicólogo,15/12/1930,09/01/2019 (aos 88 anos),"Padre Quevedo (1930-2019) foi um padre jesuíta, parapsicólogo e professor. De origem espanhola e nacionalizado brasileiro, foi o criador do famoso bordão “Isso non ecziste”."
Padre Pio de Pietrelcina, Sacerdote católico italiano,25/05/1887,23/09/1968 (aos 81 anos),"Padre Pio de Pietrelcina (1887-1968) foi um sacerdote católico italiano, da Ordem dos Frades Menores Capuchinhos. Em 2002, foi canonizado pelo Papa João Paulo II, como São Pio de Pietrelcina."
Padre Cícero, Líder católico brasileiro,24/03/1844,20/07/1934 (aos 90 anos),"Padre Cícero (1844-1934) foi um líder católico brasileiro. Foi ordenado padre em Fortaleza no ano de 1870. Realizou um trabalho pastoral, com pregações e visitas domiciliares. Conquistou a simpatia dos católicos."
Padre Maurício, Compositor brasileiro,22/09/1767,18/04/1830 (aos 62 anos),Padre Maurício (1767-1830) foi compositor brasileiro de música sacra.
Padre Marcelo Rossi, Sacerdote brasileiro,20/05/1967,não informado,"Padre Marcelo Rossi (1967) é um sacerdote católico brasileiro. Ficou conhecido nos meios de comunicação por seu jeito especial de evangelização, onde leva através da música a palavra de Deus."
Padre Manuel da Nóbrega, Padre jesuíta,18/10/1517,18/10/1570 (aos 52 anos),"Padre Manuel da Nóbrega (1517-1570) foi um missionário jesuíta português, chefe da primeira missão jesuíta mandada para a América. Deixou valiosas notícias históricas sobre o Brasil Colonial, nas cartas que enviava para a Companhia de Jesus em Portugal."
Padre Antônio Vieira, Religioso português,06/02/1608,17/06/1697 (aos 89 anos),"Padre Antônio Vieira (1608-1697) foi um religioso, escritor e orador português, a principal expressão do Barroco Literário da língua portuguesa. Escreveu cerca de 200 sermões, nos quais revela conhecimento político, social e religioso."
Pablo Picasso, Pintor espanhol,25/10/1881,08/04/1973 (aos 91 anos),"Pablo Picasso (1881-1973) foi um pintor espanhol. ""A Pomba da Paz"", ""Guernica"", ""Les Demoiselles d'Avignon"", são algumas de suas obras mais importantes. Foi um dos criadores do ""Cubismo"", um dos mais destacados movimentos de arte do século XX."
Pôncio Pilatos, Governador romano,não informado,não informado,"Pôncio Pilatos foi um governador romano, da província da Judeia, que condenou Jesus à morte por insistência dos sacerdotes judeus."
Pocahontas,não informado,não informado,não informado,"Pocahontas (1595-1617) foi uma índia, filha de Powhatan, chefe de uma tribo nativa do estado da Virgínia, nos Estados Unidos. Sua história se transformou em várias versões românticas, que deu origem ao filme “O Novo Mundo” (1995) e ao desenho animado da Disney, “Pocahontas” (2005)."
Plutarco, Filósofo e historiador grego,não informado,não informado,"Plutarco (46 - 126) foi um historiador, filósofo e prosador grego, autor de ""Vidas Paralelas"", obra bastante difundida pelos humanistas do Renascimento."
"Plínio, o Velho", Historiador romano,não informado,não informado,"Plínio, o Velho (23-79) foi um historiador, naturalista e oficial romano. Foi chamado de “o apóstolo da ciência romana”."
Plínio o Jovem, Escritor romano,não informado,não informado,"Plínio o Jovem (62-114) foi um escritor romano, orador, jurista, político e governador imperial da Bitínia. Suas cartas nos legaram um testemunho da vida quotidiana na Roma Imperial."
Plínio Marcos, Escritor e teatrólogo brasileiro,29/09/1935,29/11/1999 (aos 64 anos),"Plínio Marcos (1935-1999) foi um escritor, ator e teatrólogo brasileiro. Suas obras se destacavam pela denúncia e protesto contra as formas de organizações sociais. Suas principais peças são ""Dois Perdidos numa Noite Suja"" (1966), ""Navalha na Carne"" (1967), ""Balbina de Iansã"" (1971) e ""Abajur Lilás"" (1976)."
Plínio Salgado, Político,22/01/1895,08/12/1975 (aos 80 anos),"Plínio Salgado (1895-1975) foi um político, escritor e jornalista brasileiro. Fundou, em 1932, a Ação Integralista Brasileira – movimento político inspirado no fascismo italiano."
Platão, Filósofo grego da antiguidade,não informado,não informado,"Platão (427-347 a.C.) foi um filósofo grego da antiguidade, considerado um dos principais pensadores da história da filosofia. Era discípulo do filósofo Sócrates."
Pierre Verger, Fotógrafo francês,04/11/1902,11/02/1996 (aos 93 anos),"Pierre Verger (1902-1996) foi um fotógrafo, etnólogo, antropólogo e pesquisador francês. Tornou-se um dos principais antropólogos e historiadores da cultura brasileira, sobretudo a popular, e da ancestralidade africana presente no sangue do brasileiro."
Pitty, Cantora brasileira,07/10/1977,não informado,"Pitty (1977) é uma cantora brasileira de rock, considerada uma das maiores do gênero no Brasil."
Pitágoras, Matemático grego,não informado,não informado,"Pitágoras (582 - 497 a. C.) foi um matemático e filósofo grego. Autor do ""Teorema de Pitágoras"": ""Em um triangulo retângulo, o quadrado da hipotenusa é igual à soma dos quadrados dos catetos"". Desenvolveu trabalhos na área da filosofia, música, moral, geografia e medicina."
Pierre Simon Laplace, Matemático francês,23/03/1749,05/03/1827 (aos 77 anos),"Pierre-Simon Laplace (1749-1827) foi matemático, astrônomo e físico francês. No ""Tratado de Mecânica Celeste"", reuniu os trabalhos de vários cientistas, sobre as consequências da gravitação universal. Deixou trabalhos de refração, pêndulos, velocidade do som e dilatação dos corpos sólidos. Recebeu de Luís XVIII o título de Marquês."
Pixinguinha, Músico brasileiro,23/04/1897,17/02/1973 (aos 75 anos),"Pixinguinha (1897-1973) foi um músico brasileiro, autor da música ""Carinhoso"", em parceria com João de Barro. Foi arranjador, instrumentista e compositor, um dos maiores representantes do ""choro"" brasileiro."
Pierre Curie, Físico francês,15/05/1859,19/04/1906 (aos 46 anos),"Pierre Curie (1859-1906) foi um físico francês, pioneiro no estudo da cristalografia, magnetismo, piezeletricidade e radioatividade. Junto com sua esposa, a física Marie Curie, conduziu estudos sobre os sais de urânio e descobriu um novo elemento químico, que chamou de rádio. Em 1903, o casal ganhou o Prêmio Nobel de Física."
Piet Mondrian, Pintor holandês,07/03/1872,01/01/1944 (aos 71 anos),Piet Mondrian (1872-1944) foi um pintor holandês que despontou no começo do século XX e sua obra virou um símbolo poderoso da modernidade.
Pierre Bourdieu, Sociólogo francês,01/08/1930,23/01/2002 (aos 71 anos),"Pierre Bourdieu, (1930-2002) foi um importante sociólogo e pensador francês, autor de uma série de obras que contribuíram para renovar o entendimento da Sociologia e da Etnologia no século XX."
Pierre Bayle, Filósofo francês,18/11/1647,28/12/1706 (aos 59 anos),"Pierre Bayle (1647-1706) foi um filósofo cético e escritor francês, pai da tolerância religiosa e autor do “Dicionário Histórico e Crítico”, o livro mais popular na Europa no fim do século XVII e começo do século XVIII."
Peter Paul Rubens, Pintor flamengo,28/06/1577,30/05/1640 (aos 62 anos),"Peter Paul Rubens (1577-1640) foi um importante pintor flamengo, um dos maiores representantes do Barroco na Europa do século XVII."
Peter Drucker, Consultor administrativo,19/11/1909,11/11/2005 (aos 95 anos),"Peter Drucker (1909-2005) foi um consultor administrativo, analista financeiro, professor, jornalista e escritor austríaco. Foi considerado um dos maiores especialista em Administração Moderna."
Peter Handke, Escritor austríaco,06/12/1942,não informado,Peter Handke é um celebrado escritor austríaco - considerado um dos maiores autores de língua alemã - que recebeu o Prêmio Nobel de Literatura em 2019.
Pero Vaz de Caminha, Escrivão  português,1450,1500 (aos 50 anos),"Pero Vaz de Caminha (1450-1500) foi um escrivão português, autor da carta, que relatou ao Rei de Portugal, Dom Manuel I, as notícias da chegada ao Brasil da esquadra comandada por Pedro Álvares Cabral, em 1500."
Pero Lopes de Sousa,não informado,não informado,não informado,"Pero Lopes de Sousa (1497-1539) foi um navegador português, responsável pelo Diário de Navegação da primeira expedição colonizadora de seu irmão Martim Afonso de Sousa, que veio para o Brasil em 1530. Teve grande participação na luta contra os franceses."
